title,thumbnail,view_to_sub,channel_sub,published_at,published_at_date
The Most Epic Drama To Ever Occupy The White House - The West Wing Cast Takes Over A Late Show,https://i.ytimg.com/vi/jDKpq0ditcE/hqdefault.jpg,0.116333544,7900000,2020-10-10T04:11:34Z,10/10/2020
"Jon Pardi ""Ain't Always the Cowboy"" - Late Show #PlayAtHome",https://i.ytimg.com/vi/BQg404lbnM0/hqdefault.jpg,0.001599747,7900000,2020-10-09T17:50:04Z,9/10/2020
Sadiq Khan interview: London will go to Tier 2 lockdown,https://i.ytimg.com/vi/xDH0bbr59-g/hqdefault.jpg,0.018968481,34900,2020-10-13T18:17:10Z,13/10/2020
'The BBC is under threat' | Private Eye editor Ian Hislop interview,https://i.ytimg.com/vi/uvaSGeuFvSk/hqdefault.jpg,0.741518625,34900,2020-10-08T15:45:35Z,8/10/2020
PMQs Boris Johnson v Keir Starmer: 'I'll explain it to him slowly',https://i.ytimg.com/vi/aWZBYYgOZr4/hqdefault.jpg,0.087449857,34900,2020-10-07T11:30:00Z,7/10/2020
"Voicing Donald Trump, Boris Johnson and Keir Starmer for Spitting Image | Matt Forde interview",https://i.ytimg.com/vi/NI6Slvoa-DQ/hqdefault.jpg,0.36,34900,2020-10-02T13:48:04Z,2/10/2020
PMQs Boris Johnson v Keir Starmer: Extraordinary Speaker statement accuses government of 'contempt',https://i.ytimg.com/vi/vQaYogjfZ_g/hqdefault.jpg,0.062378223,34900,2020-09-30T11:36:15Z,30/9/2020
PMQS LIVE: Boris Johnson vs. Keir Starmer,https://i.ytimg.com/vi/-S6xoICqpHk/hqdefault.jpg,0.042005731,34900,2020-09-30T11:01:03Z,30/9/2020
MP makes astonishing anti-lockdown speech in parliament,https://i.ytimg.com/vi/lOdstAhVd_4/hqdefault.jpg,0.213381089,34900,2020-09-29T09:23:42Z,29/9/2020
PMQs Boris Johnson v Keir Starmer: Pub curfew and track and trace,https://i.ytimg.com/vi/PLwg8EsGA_E/hqdefault.jpg,0.035558739,34900,2020-09-23T11:37:38Z,23/9/2020
PMQs Boris Johnson v Angela Rayner: Grouse shooting and constituent Keir,https://i.ytimg.com/vi/TmF6Us3Wh1w/hqdefault.jpg,0.091002865,34900,2020-09-16T11:36:10Z,16/9/2020
Girlfriend Reacts: 30 vs 1 Dating App In Real Life | Jubilee,https://i.ytimg.com/vi/PrIBixP5rOs/hqdefault.jpg,0.088582418,546000,2020-10-13T16:15:01Z,13/10/2020
Millionaire Reacts: Living On $60K A Year In Boston | Millennial Money,https://i.ytimg.com/vi/IiulBNH-cDM/hqdefault.jpg,0.13918315,546000,2020-10-09T20:33:46Z,9/10/2020
Millionaire Reacts: The World's Cheapest Date | Extreme Cheapskates,https://i.ytimg.com/vi/lAR_Ksj6GiA/hqdefault.jpg,0.154496337,546000,2020-10-08T14:52:27Z,8/10/2020
Millionaire Reacts: THE MJ FAMILY OFFICIAL NEW HOUSE TOUR!!,https://i.ytimg.com/vi/tef3YcFKkvk/hqdefault.jpg,0.094820513,546000,2020-10-06T07:31:25Z,6/10/2020
How To Make The 31 Cent Iced Matcha Latte | Lifestyle Inflation,https://i.ytimg.com/vi/oR2w7Um9kmc/hqdefault.jpg,0.12859707,546000,2020-10-03T04:51:23Z,3/10/2020
Millionaire Reacts: Rich And Poor People Seek To Understand Each Other | Middle Ground,https://i.ytimg.com/vi/aHAQehOyIY8/hqdefault.jpg,0.254886447,546000,2020-09-30T23:10:31Z,30/9/2020
Millionaire Reacts: How this Freelance Photographer Making $125K In NYC Budgets Her Income | Glamour,https://i.ytimg.com/vi/jH7nlaRHgDM/hqdefault.jpg,0.158479853,546000,2020-09-28T23:21:37Z,28/9/2020
"Millionaire Reacts: Living On $227K A Year In London, England | Millennial Money",https://i.ytimg.com/vi/ODJlYg9imr8/hqdefault.jpg,0.235261905,546000,2020-09-26T07:25:41Z,26/9/2020
Millionaire Reacts: How Miles Bridges Spent His First $1M in the NBA,https://i.ytimg.com/vi/dvwCoJSR0kQ/hqdefault.jpg,0.097098901,546000,2020-09-23T23:03:05Z,23/9/2020
"Confronting Jeremy Financial Education | Exposing His $1,000,000 Portfolio",https://i.ytimg.com/vi/cwd5um2ZLx8/hqdefault.jpg,0.811474201,40700,2020-10-07T03:21:46Z,7/10/2020
Millionaire Dating Expert Reveals How To Get A Girlfriend ft. Kong Pham,https://i.ytimg.com/vi/_HMtis67OtM/hqdefault.jpg,0.621056511,40700,2020-10-04T06:34:04Z,4/10/2020
"Confronting MeetKevin | How He Makes $1,000,000 Per Month",https://i.ytimg.com/vi/ZwH8FZ3XZZQ/hqdefault.jpg,5.731965602,40700,2020-09-27T09:01:46Z,27/9/2020
Stock Options EXPERT Teaches Graham Stephan How to Invest | Ft. @Savannah Smiles,https://i.ytimg.com/vi/8L7NBYf6DLw/hqdefault.jpg,0.753513514,40700,2020-09-20T03:15:45Z,20/9/2020
Prank Calling Billie Eilish and Drake with Airrack,https://i.ytimg.com/vi/b75tZWUoyeY/hqdefault.jpg,0.366805897,40700,2020-09-13T09:41:29Z,13/9/2020
"How to travel the ENTIRE world for $10,000 | Cassie De Pecol",https://i.ytimg.com/vi/oT87g2qQVOA/hqdefault.jpg,0.488771499,40700,2020-09-06T05:32:32Z,6/9/2020
Confronting Shelby Church And How She Spends Her Money,https://i.ytimg.com/vi/W7htjS8YCXw/hqdefault.jpg,1.665675676,40700,2020-08-30T04:33:22Z,30/8/2020
Revealing How Much Money The Graham Stephan Show Makes! | Ep. 14,https://i.ytimg.com/vi/-BVQRQ2eCEM/hqdefault.jpg,0.34953317,40700,2020-08-21T04:26:44Z,21/8/2020
How To Meet Will Smith and Mr Beast ft. Colin and Samir | Iced Coffee Hour Clips Ep.13,https://i.ytimg.com/vi/u5bBOzRIow8/hqdefault.jpg,0.072628993,40700,2020-08-19T04:27:43Z,19/8/2020
Reacting to POKEMON Tik Toks That Are ACTUALLY Hilarious,https://i.ytimg.com/vi/RqL0eIxoC6E/hqdefault.jpg,0.151788618,12300,2020-09-30T16:44:43Z,30/9/2020
GENIUS Inventions and Ideas You Won't Believe Exist!,https://i.ytimg.com/vi/1rDdLpxF3Ts/hqdefault.jpg,0.682682927,12300,2020-09-05T03:41:15Z,5/9/2020
Funny ANIMALS That Will Make You Laugh,https://i.ytimg.com/vi/ygHj0_QLpk0/hqdefault.jpg,0.484065041,12300,2020-08-18T16:38:55Z,18/8/2020
GENIUS Kids Who Beat the System!,https://i.ytimg.com/vi/3taQM4emAd8/hqdefault.jpg,0.494878049,12300,2020-08-15T15:45:36Z,15/8/2020
Funniest DESIGN Fails That Make NO Sense,https://i.ytimg.com/vi/WCTQPALxqBY/hqdefault.jpg,0.688943089,12300,2020-08-09T21:35:53Z,9/8/2020
How Political Questions Mess with Your Brain,https://i.ytimg.com/vi/8NYaDNK0xvM/hqdefault.jpg,0.069510708,607000,2020-10-08T18:29:42Z,8/10/2020
"We Don't All Have a ""Mind's Eye"" | Aphantasia",https://i.ytimg.com/vi/A91tvp0b1fY/hqdefault.jpg,0.114285008,607000,2020-10-01T19:24:19Z,1/10/2020
How Losing Your Job Changes You,https://i.ytimg.com/vi/LaX2Db9syRg/hqdefault.jpg,0.055116969,607000,2020-09-22T18:36:46Z,22/9/2020
How Psychics Exploit Our Cognitive Biases,https://i.ytimg.com/vi/4nq-g1BXkt8/hqdefault.jpg,0.061477759,607000,2020-09-17T15:09:06Z,17/9/2020
Why Is It So Hard to Remember Things Right Now?,https://i.ytimg.com/vi/ULdW78vnRQs/hqdefault.jpg,0.103644152,607000,2020-09-10T16:37:58Z,10/9/2020
Studying the Brain with... Quantum Mechanics?,https://i.ytimg.com/vi/xsGJkSDtLvo/hqdefault.jpg,0.140321252,607000,2020-09-03T20:51:28Z,3/9/2020
Why We Love Movie Villains (According to Psychology),https://i.ytimg.com/vi/2IkBJogw5G0/hqdefault.jpg,0.076975288,607000,2020-08-27T19:50:42Z,27/8/2020
3 Friendly Robots Improving Our Social Lives,https://i.ytimg.com/vi/jwwr5zuaW9o/hqdefault.jpg,0.042965404,607000,2020-08-20T15:23:40Z,20/8/2020
What Whistled Speech Tells Us About How the Brain Interprets Language,https://i.ytimg.com/vi/7gvfDB5_cz4/hqdefault.jpg,0.056807249,607000,2020-08-13T15:57:35Z,13/8/2020
"""Life"" on Venus and other nature news from September 2020",https://i.ytimg.com/vi/jwNoAL3z94U/hqdefault.jpg,0.063647059,17000,2020-09-25T23:16:31Z,25/9/2020
How Ankylosaurs Got Their Clubs,https://i.ytimg.com/vi/lRt-4SdzWrk/hqdefault.jpg,0.036065333,1500000,2020-10-13T21:18:07Z,13/10/2020
How Plants Became Carnivores,https://i.ytimg.com/vi/aGJ7tg0ifmo/hqdefault.jpg,0.213256667,1500000,2020-10-07T15:48:42Z,7/10/2020
The First and Last North American Primates,https://i.ytimg.com/vi/WNL9Jp9oeYA/hqdefault.jpg,0.15362,1500000,2020-09-30T18:20:29Z,30/9/2020
When Rodents Had Horns,https://i.ytimg.com/vi/zwJwAstYV2w/hqdefault.jpg,0.169894,1500000,2020-09-15T20:17:30Z,15/9/2020
The Sea Monster from the Andes,https://i.ytimg.com/vi/1MCZrZiq9BE/hqdefault.jpg,0.231124,1500000,2020-09-10T19:22:59Z,10/9/2020
How Ancient Art Captured Australian Megafauna,https://i.ytimg.com/vi/Zdm-6P6AdcA/hqdefault.jpg,0.205163333,1500000,2020-09-02T17:16:22Z,2/9/2020
The Oddest Couple in the Fossil Record,https://i.ytimg.com/vi/T2kURaqzCdA/hqdefault.jpg,0.412376,1500000,2020-08-20T21:04:30Z,20/8/2020
How We Figured Out Fermentation,https://i.ytimg.com/vi/-ntbeRiQ0cg/hqdefault.jpg,0.300151333,1500000,2020-08-13T21:26:11Z,13/8/2020
The Dinosaur Who Was Buried at Sea,https://i.ytimg.com/vi/a-UZXBF63z4/hqdefault.jpg,0.592152667,1500000,2020-08-05T17:34:23Z,5/8/2020
Water Is Thicker When You’re Smaller,https://i.ytimg.com/vi/TUf2X3hqCPU/hqdefault.jpg,0.076571096,429000,2020-10-12T18:47:51Z,12/10/2020
Do Microscopic Immortals Actually Exist?,https://i.ytimg.com/vi/vSV9G5s4_SM/hqdefault.jpg,0.104967366,429000,2020-10-03T18:05:58Z,3/10/2020
Can Microbes See Without Eyes?,https://i.ytimg.com/vi/aHs2Vh-Llrc/hqdefault.jpg,0.152643357,429000,2020-09-29T01:59:53Z,29/9/2020
Ophyroglena: The Tricky Transforming Ciliate,https://i.ytimg.com/vi/17tug6T-4jc/hqdefault.jpg,0.114237762,429000,2020-09-21T15:09:45Z,21/9/2020
The Fungus That Traps and Kills Nematodes,https://i.ytimg.com/vi/V6g3OjkhClE/hqdefault.jpg,0.191561772,429000,2020-09-13T16:31:07Z,13/9/2020
Lacrymaria: Vicious Long-Necked Predators,https://i.ytimg.com/vi/rWtMIQguUOo/hqdefault.jpg,0.24167366,429000,2020-09-06T23:22:14Z,6/9/2020
Our Paramecia Are Infected,https://i.ytimg.com/vi/foKz81ElCjM/hqdefault.jpg,0.245932401,429000,2020-08-31T00:46:53Z,31/8/2020
Flatworms: Simple Wiggly Tubes,https://i.ytimg.com/vi/KmiHo_tYwkk/hqdefault.jpg,0.170018648,429000,2020-08-24T04:36:06Z,24/8/2020
How Do Microorganisms Poop Without a Butthole?,https://i.ytimg.com/vi/G2oRwfyyQgg/hqdefault.jpg,0.182370629,429000,2020-08-17T14:13:43Z,17/8/2020
How Different Generations Talk About Climate Change | Hot Mess,https://i.ytimg.com/vi/TQYo9nk-Zlw/hqdefault.jpg,0.070703043,95300,2020-09-24T17:00:49Z,24/9/2020
'Confucius' Postmortem Stream,https://i.ytimg.com/vi/tb5dwEGiN6o/hqdefault.jpg,0.254058442,30800,2020-10-11T13:09:21Z,11/10/2020
A Chat With Adam Conover,https://i.ytimg.com/vi/JBcjKopyYz8/hqdefault.jpg,0.14237013,30800,2020-09-07T18:28:04Z,7/9/2020
'Who's Afraid of the Experts?'' Postmortem Stream,https://i.ytimg.com/vi/Y7BEWA1r-to/hqdefault.jpg,0.424512987,30800,2020-09-08T16:58:11Z,8/9/2020
"'Logic' Postmortem & 700,000 Subs Stream!",https://i.ytimg.com/vi/cBKJJ7NnszM/hqdefault.jpg,0.414253247,30800,2020-08-14T15:00:59Z,14/8/2020
How Ankylosaurs Got Their Clubs,https://i.ytimg.com/vi/lRt-4SdzWrk/hqdefault.jpg,0.036065333,1500000,2020-10-13T21:18:07Z,13/10/2020
How Plants Became Carnivores,https://i.ytimg.com/vi/aGJ7tg0ifmo/hqdefault.jpg,0.213256667,1500000,2020-10-07T15:48:42Z,7/10/2020
The First and Last North American Primates,https://i.ytimg.com/vi/WNL9Jp9oeYA/hqdefault.jpg,0.15362,1500000,2020-09-30T18:20:29Z,30/9/2020
When Rodents Had Horns,https://i.ytimg.com/vi/zwJwAstYV2w/hqdefault.jpg,0.169894,1500000,2020-09-15T20:17:30Z,15/9/2020
The Sea Monster from the Andes,https://i.ytimg.com/vi/1MCZrZiq9BE/hqdefault.jpg,0.231124,1500000,2020-09-10T19:22:59Z,10/9/2020
How Ancient Art Captured Australian Megafauna,https://i.ytimg.com/vi/Zdm-6P6AdcA/hqdefault.jpg,0.205163333,1500000,2020-09-02T17:16:22Z,2/9/2020
The Oddest Couple in the Fossil Record,https://i.ytimg.com/vi/T2kURaqzCdA/hqdefault.jpg,0.412376,1500000,2020-08-20T21:04:30Z,20/8/2020
How We Figured Out Fermentation,https://i.ytimg.com/vi/-ntbeRiQ0cg/hqdefault.jpg,0.300151333,1500000,2020-08-13T21:26:11Z,13/8/2020
The Dinosaur Who Was Buried at Sea,https://i.ytimg.com/vi/a-UZXBF63z4/hqdefault.jpg,0.592152667,1500000,2020-08-05T17:34:23Z,5/8/2020
How Political Questions Mess with Your Brain,https://i.ytimg.com/vi/8NYaDNK0xvM/hqdefault.jpg,0.069510708,607000,2020-10-08T18:29:42Z,8/10/2020
"We Don't All Have a ""Mind's Eye"" | Aphantasia",https://i.ytimg.com/vi/A91tvp0b1fY/hqdefault.jpg,0.114285008,607000,2020-10-01T19:24:19Z,1/10/2020
How Losing Your Job Changes You,https://i.ytimg.com/vi/LaX2Db9syRg/hqdefault.jpg,0.055116969,607000,2020-09-22T18:36:46Z,22/9/2020
How Psychics Exploit Our Cognitive Biases,https://i.ytimg.com/vi/4nq-g1BXkt8/hqdefault.jpg,0.061477759,607000,2020-09-17T15:09:06Z,17/9/2020
Why Is It So Hard to Remember Things Right Now?,https://i.ytimg.com/vi/ULdW78vnRQs/hqdefault.jpg,0.103644152,607000,2020-09-10T16:37:58Z,10/9/2020
Studying the Brain with... Quantum Mechanics?,https://i.ytimg.com/vi/xsGJkSDtLvo/hqdefault.jpg,0.140321252,607000,2020-09-03T20:51:28Z,3/9/2020
Why We Love Movie Villains (According to Psychology),https://i.ytimg.com/vi/2IkBJogw5G0/hqdefault.jpg,0.076975288,607000,2020-08-27T19:50:42Z,27/8/2020
3 Friendly Robots Improving Our Social Lives,https://i.ytimg.com/vi/jwwr5zuaW9o/hqdefault.jpg,0.042965404,607000,2020-08-20T15:23:40Z,20/8/2020
What Whistled Speech Tells Us About How the Brain Interprets Language,https://i.ytimg.com/vi/7gvfDB5_cz4/hqdefault.jpg,0.056807249,607000,2020-08-13T15:57:35Z,13/8/2020
"Why Do We Say ""African American""?",https://i.ytimg.com/vi/8ysHIQQweoE/hqdefault.jpg,0.318636095,338000,2020-09-30T18:08:24Z,30/9/2020
History of Socialism in America,https://i.ytimg.com/vi/80mtCNd-JEw/hqdefault.jpg,0.075982249,338000,2020-09-22T17:31:57Z,22/9/2020
The Homophobic Origins of U.S. Law,https://i.ytimg.com/vi/GQ3oXdhyjYs/hqdefault.jpg,0.155192308,338000,2020-09-02T18:14:05Z,2/9/2020
Why Do We Shake Hands?,https://i.ytimg.com/vi/xMDiZseUAGw/hqdefault.jpg,0.119887574,338000,2020-08-19T18:03:58Z,19/8/2020
The Racist Origins of U.S. Law,https://i.ytimg.com/vi/FFebp7GZeHY/hqdefault.jpg,0.456467456,338000,2020-08-05T20:49:18Z,5/8/2020
How To Vote In Every State 2020: COVID-19 Update,https://i.ytimg.com/vi/GBiBiQORPnQ/hqdefault.jpg,0.588873039,7010,2020-09-04T18:49:40Z,4/9/2020
5 Actions Beyond The Voting Booth,https://i.ytimg.com/vi/slpUHl_KXnQ/hqdefault.jpg,0.175035663,7010,2020-08-28T20:37:00Z,28/8/2020
Demystifying The Voting Process | MediaWise Voter Guide #8,https://i.ytimg.com/vi/7PkjHZ2fPiM/hqdefault.jpg,0.091726106,7010,2020-08-17T20:39:30Z,17/8/2020
How to Read a Poll | MediaWise Voter Guide #7,https://i.ytimg.com/vi/o_9JQe-78B0/hqdefault.jpg,0.069614836,7010,2020-08-10T19:30:33Z,10/8/2020
How to REALLY watch a political ad | MediaWise Voter Guide #6,https://i.ytimg.com/vi/QavFSLoM1a8/hqdefault.jpg,0.092011412,7010,2020-08-03T23:55:30Z,3/8/2020
How to Consume Political News | MediaWise Voter Guide #5,https://i.ytimg.com/vi/71MkLEasUo8/hqdefault.jpg,0.111840228,7010,2020-07-27T17:37:44Z,27/7/2020
How Different Generations Talk About Climate Change | Hot Mess,https://i.ytimg.com/vi/TQYo9nk-Zlw/hqdefault.jpg,0.070703043,95300,2020-09-24T17:00:49Z,24/9/2020
How Political Questions Mess with Your Brain,https://i.ytimg.com/vi/8NYaDNK0xvM/hqdefault.jpg,0.069510708,607000,2020-10-08T18:29:42Z,8/10/2020
"We Don't All Have a ""Mind's Eye"" | Aphantasia",https://i.ytimg.com/vi/A91tvp0b1fY/hqdefault.jpg,0.114289951,607000,2020-10-01T19:24:19Z,1/10/2020
How Losing Your Job Changes You,https://i.ytimg.com/vi/LaX2Db9syRg/hqdefault.jpg,0.055116969,607000,2020-09-22T18:36:46Z,22/9/2020
How Psychics Exploit Our Cognitive Biases,https://i.ytimg.com/vi/4nq-g1BXkt8/hqdefault.jpg,0.061477759,607000,2020-09-17T15:09:06Z,17/9/2020
Why Is It So Hard to Remember Things Right Now?,https://i.ytimg.com/vi/ULdW78vnRQs/hqdefault.jpg,0.103644152,607000,2020-09-10T16:37:58Z,10/9/2020
Studying the Brain with... Quantum Mechanics?,https://i.ytimg.com/vi/xsGJkSDtLvo/hqdefault.jpg,0.140321252,607000,2020-09-03T20:51:28Z,3/9/2020
Why We Love Movie Villains (According to Psychology),https://i.ytimg.com/vi/2IkBJogw5G0/hqdefault.jpg,0.076975288,607000,2020-08-27T19:50:42Z,27/8/2020
3 Friendly Robots Improving Our Social Lives,https://i.ytimg.com/vi/jwwr5zuaW9o/hqdefault.jpg,0.042965404,607000,2020-08-20T15:23:40Z,20/8/2020
What Whistled Speech Tells Us About How the Brain Interprets Language,https://i.ytimg.com/vi/7gvfDB5_cz4/hqdefault.jpg,0.056807249,607000,2020-08-13T15:57:35Z,13/8/2020
"""Life"" on Venus and other nature news from September 2020",https://i.ytimg.com/vi/jwNoAL3z94U/hqdefault.jpg,0.063647059,17000,2020-09-25T23:16:31Z,25/9/2020
How Ankylosaurs Got Their Clubs,https://i.ytimg.com/vi/lRt-4SdzWrk/hqdefault.jpg,0.036065333,1500000,2020-10-13T21:18:07Z,13/10/2020
How Plants Became Carnivores,https://i.ytimg.com/vi/aGJ7tg0ifmo/hqdefault.jpg,0.213256667,1500000,2020-10-07T15:48:42Z,7/10/2020
The First and Last North American Primates,https://i.ytimg.com/vi/WNL9Jp9oeYA/hqdefault.jpg,0.15362,1500000,2020-09-30T18:20:29Z,30/9/2020
When Rodents Had Horns,https://i.ytimg.com/vi/zwJwAstYV2w/hqdefault.jpg,0.169894,1500000,2020-09-15T20:17:30Z,15/9/2020
The Sea Monster from the Andes,https://i.ytimg.com/vi/1MCZrZiq9BE/hqdefault.jpg,0.231124,1500000,2020-09-10T19:22:59Z,10/9/2020
How Ancient Art Captured Australian Megafauna,https://i.ytimg.com/vi/Zdm-6P6AdcA/hqdefault.jpg,0.205163333,1500000,2020-09-02T17:16:22Z,2/9/2020
The Oddest Couple in the Fossil Record,https://i.ytimg.com/vi/T2kURaqzCdA/hqdefault.jpg,0.412376,1500000,2020-08-20T21:04:30Z,20/8/2020
How We Figured Out Fermentation,https://i.ytimg.com/vi/-ntbeRiQ0cg/hqdefault.jpg,0.300151333,1500000,2020-08-13T21:26:11Z,13/8/2020
The Dinosaur Who Was Buried at Sea,https://i.ytimg.com/vi/a-UZXBF63z4/hqdefault.jpg,0.592152667,1500000,2020-08-05T17:34:23Z,5/8/2020
How Different Generations Talk About Climate Change | Hot Mess,https://i.ytimg.com/vi/TQYo9nk-Zlw/hqdefault.jpg,0.070703043,95300,2020-09-24T17:00:49Z,24/9/2020
How Political Questions Mess with Your Brain,https://i.ytimg.com/vi/8NYaDNK0xvM/hqdefault.jpg,0.069510708,607000,2020-10-08T18:29:42Z,8/10/2020
"We Don't All Have a ""Mind's Eye"" | Aphantasia",https://i.ytimg.com/vi/A91tvp0b1fY/hqdefault.jpg,0.114289951,607000,2020-10-01T19:24:19Z,1/10/2020
How Losing Your Job Changes You,https://i.ytimg.com/vi/LaX2Db9syRg/hqdefault.jpg,0.055116969,607000,2020-09-22T18:36:46Z,22/9/2020
How Psychics Exploit Our Cognitive Biases,https://i.ytimg.com/vi/4nq-g1BXkt8/hqdefault.jpg,0.061477759,607000,2020-09-17T15:09:06Z,17/9/2020
Why Is It So Hard to Remember Things Right Now?,https://i.ytimg.com/vi/ULdW78vnRQs/hqdefault.jpg,0.103644152,607000,2020-09-10T16:37:58Z,10/9/2020
Studying the Brain with... Quantum Mechanics?,https://i.ytimg.com/vi/xsGJkSDtLvo/hqdefault.jpg,0.140321252,607000,2020-09-03T20:51:28Z,3/9/2020
Why We Love Movie Villains (According to Psychology),https://i.ytimg.com/vi/2IkBJogw5G0/hqdefault.jpg,0.076975288,607000,2020-08-27T19:50:42Z,27/8/2020
3 Friendly Robots Improving Our Social Lives,https://i.ytimg.com/vi/jwwr5zuaW9o/hqdefault.jpg,0.042965404,607000,2020-08-20T15:23:40Z,20/8/2020
What Whistled Speech Tells Us About How the Brain Interprets Language,https://i.ytimg.com/vi/7gvfDB5_cz4/hqdefault.jpg,0.056807249,607000,2020-08-13T15:57:35Z,13/8/2020
The rock vlog,https://i.ytimg.com/vi/yKmVRQUvbco/hqdefault.jpg,0.298631579,38000,2020-10-02T18:14:53Z,2/10/2020
The filming field is ready!,https://i.ytimg.com/vi/5Ccat99ek1w/hqdefault.jpg,0.258026316,38000,2020-09-25T14:46:18Z,25/9/2020
Building the gym!,https://i.ytimg.com/vi/EvDv7ClRMlg/hqdefault.jpg,0.253473684,38000,2020-09-16T11:46:05Z,16/9/2020
The countryside people go to the capital!,https://i.ytimg.com/vi/y0lnAckRgqc/hqdefault.jpg,0.327789474,38000,2020-09-02T16:49:31Z,2/9/2020
Finnish macaroni casserole!,https://i.ytimg.com/vi/mq4oNyiqVWo/hqdefault.jpg,0.414157895,38000,2020-08-27T15:32:46Z,27/8/2020
Building a filming field!,https://i.ytimg.com/vi/vNTDMfXdGF8/hqdefault.jpg,0.342447368,38000,2020-08-20T16:41:28Z,20/8/2020
Our log cabin! 🏡,https://i.ytimg.com/vi/JO5QRsPsKZs/hqdefault.jpg,0.304473684,38000,2020-08-13T08:43:15Z,13/8/2020
Moving update and testing a new wood burning hot tub!,https://i.ytimg.com/vi/Au-zJlZJnGY/hqdefault.jpg,0.412421053,38000,2020-08-05T12:21:56Z,5/8/2020
EMPTY HOUSE TOUR | Finnish countryside,https://i.ytimg.com/vi/pTE2NMp7NzU/hqdefault.jpg,0.520552632,38000,2020-07-29T10:45:40Z,29/7/2020
"I Tested Clickbait DIY Soap ""Hacks""",https://i.ytimg.com/vi/0ST4_hmop9Y/hqdefault.jpg,0.581223145,9030000,2020-10-07T02:16:03Z,7/10/2020
I Tried Acrylic Pour Art For The First Time,https://i.ytimg.com/vi/58XEfDtU0Z4/hqdefault.jpg,0.592326024,9030000,2020-09-06T01:31:16Z,6/9/2020
SATURDAY NIGHT LIVESTREAM! - Attempting to draw while in fursuit! 🤪,https://i.ytimg.com/vi/t0Ms1xinKCo/hqdefault.jpg,0.057729659,76200,2020-09-20T02:10:33Z,20/9/2020
"Fan Mail #28 📭 (Michigan, Insane Art, Tails and A GAME CONSOLE?!!)",https://i.ytimg.com/vi/4yGfyeoUFps/hqdefault.jpg,0.057992126,76200,2020-10-01T09:40:43Z,1/10/2020
SATURDAY NIGHT LIVESTREAM! - Talking southern and just being silly,https://i.ytimg.com/vi/vbD2ppCdoS0/hqdefault.jpg,0.063254593,76200,2020-09-06T02:06:02Z,6/9/2020
Do Furries Run the Internet? 🙀 (Stormi Analyzes),https://i.ytimg.com/vi/_XqqBrbMFKw/hqdefault.jpg,0.096811024,76200,2020-09-12T03:14:19Z,12/9/2020
SATURDAY NIGHT LIVESTREAM! - Should I make animations? 👀,https://i.ytimg.com/vi/KgRPvqZ2xB8/hqdefault.jpg,0.052152231,76200,2020-08-23T02:03:38Z,23/8/2020
SATURDAY NIGHT LIVESTREAM! - TWO HURRICANES?!!,https://i.ytimg.com/vi/40Qdhh6mD2w/hqdefault.jpg,0.062375328,76200,2020-08-23T00:06:05Z,23/8/2020
"Fan Mail #27 📬 (Peeps, Spoons, Bats and a SCULPTURE?!)",https://i.ytimg.com/vi/MForvohl0vI/hqdefault.jpg,0.097467192,76200,2020-08-18T10:52:14Z,18/8/2020
SATURDAY NIGHT LIVESTREAM! - Streaming solo :(,https://i.ytimg.com/vi/Ka8gqdH-yG0/hqdefault.jpg,0.07328084,76200,2020-08-09T00:12:21Z,9/8/2020
Kemono Fursuits!! 😍 HOW ARE THEY SO CUTE?!,https://i.ytimg.com/vi/kjdr-MKIm2I/hqdefault.jpg,0.562585302,76200,2020-08-01T09:12:35Z,1/8/2020
Campfire Stories - Old Jobs,https://i.ytimg.com/vi/G07Hco79WkU/hqdefault.jpg,0.177634855,241000,2020-10-13T21:00:42Z,13/10/2020
Fallout New Vegas - Sexy Lady,https://i.ytimg.com/vi/6K6PdEYt_1s/hqdefault.jpg,0.083240664,241000,2020-08-07T14:37:01Z,7/8/2020
Oblivion - King of Worms - Part 31,https://i.ytimg.com/vi/EKWALqJ-IWQ/hqdefault.jpg,0.031041494,241000,2020-10-07T19:55:12Z,7/10/2020
Civilization V (NCR Full Stream),https://i.ytimg.com/vi/4PlLTUurk_8/hqdefault.jpg,0.107618257,241000,2020-10-06T21:05:19Z,6/10/2020
Fallout New Vegas - Dino Quest,https://i.ytimg.com/vi/EextGaayXCU/hqdefault.jpg,0.098929461,241000,2020-10-02T12:55:59Z,2/10/2020
Wilderness Stories - MRE Opinions,https://i.ytimg.com/vi/QaJfSKYJNJs/hqdefault.jpg,0.336493776,241000,2020-09-23T05:31:19Z,23/9/2020
Fallout New Vegas - Heart Shaped Box,https://i.ytimg.com/vi/AlFoLpX7O84/hqdefault.jpg,0.130784232,241000,2020-08-04T22:05:31Z,4/8/2020
Oblivion - Necromancer's Moon - Part 30,https://i.ytimg.com/vi/6KsjHJPXma0/hqdefault.jpg,0.033224066,241000,2020-10-01T21:34:19Z,1/10/2020
Fallout New Vegas - Vanessa,https://i.ytimg.com/vi/RVz95BDEznQ/hqdefault.jpg,0.198630705,241000,2020-08-03T13:43:10Z,3/8/2020
Binging with Babish: Restaurant Wars from Steven Universe,https://i.ytimg.com/vi/J2eU4Ol3IDU/hqdefault.jpg,0.101407481,8020000,2020-10-13T13:00:04Z,13/10/2020
Soup and Ice Cream on Fire | Stump Sohla,https://i.ytimg.com/vi/WKsJC1nuqVo/hqdefault.jpg,0.14340586,8020000,2020-10-10T12:06:32Z,10/10/2020
Pizza Dough | Basics with Babish,https://i.ytimg.com/vi/n1O3uHPCOLA/hqdefault.jpg,0.162080299,8020000,2020-10-07T19:46:42Z,7/10/2020
Binging with Babish: Garlic Bread from Scott Pilgrim vs The World,https://i.ytimg.com/vi/jBnWZijMbMY/hqdefault.jpg,0.305952618,8020000,2020-10-05T21:31:47Z,5/10/2020
Binging with Babish: Raspberry Danish from Ant Man & The Wasp,https://i.ytimg.com/vi/Zhq20aCSh-s/hqdefault.jpg,0.195766833,8020000,2020-09-29T00:29:14Z,29/9/2020
7-Course Convenience Store Tasting Menu | Stump Sohla,https://i.ytimg.com/vi/4zDZV-jGJ6w/hqdefault.jpg,0.313859102,8020000,2020-09-26T16:47:06Z,26/9/2020
18th Century Mac & Cheese | Stump Sohla,https://i.ytimg.com/vi/D0fsCXflDCE/hqdefault.jpg,0.299334913,8020000,2020-09-24T00:40:32Z,24/9/2020
Binging with Babish: Triple Gooberberry Sunrise from SpongeBob SquarePants,https://i.ytimg.com/vi/Gso2WrBcV2Q/hqdefault.jpg,0.278593641,8020000,2020-09-18T18:54:38Z,18/9/2020
Braised Short Ribs | Basics with Babish,https://i.ytimg.com/vi/DUTyGfwdBaY/hqdefault.jpg,0.182852993,8020000,2020-09-16T18:51:53Z,16/9/2020
GHOST OF TSUSHIMA SONG - When Honor Dies by Miracle Of Sound,https://i.ytimg.com/vi/1knq8Slj7i4/hqdefault.jpg,0.990256732,557000,2020-08-06T15:56:16Z,6/8/2020
Abysm 2: Infernal Contract - Doom Mod Madness,https://i.ytimg.com/vi/yCt_C49zjiQ/hqdefault.jpg,0.189442935,73600,2020-10-11T20:54:42Z,11/10/2020
Doomed Demo Disk - Doom Mod Madness,https://i.ytimg.com/vi/p-3eyEpwh4A/hqdefault.jpg,0.453016304,73600,2020-10-03T14:47:31Z,3/10/2020
Spaghetti Weapons - Doom Mod Madness,https://i.ytimg.com/vi/Rr9rJsaeP3I/hqdefault.jpg,0.454809783,73600,2020-09-26T08:45:51Z,26/9/2020
Trench Foot (Alpha) - Doom Mod Madness,https://i.ytimg.com/vi/J-4GNnne1jw/hqdefault.jpg,0.759891304,73600,2020-09-18T14:46:05Z,18/9/2020
So I Tried... BPM: BULLETS PER MINUTE,https://i.ytimg.com/vi/xTvFvdCWHHs/hqdefault.jpg,0.360625,73600,2020-09-11T15:51:00Z,11/9/2020
Alien Armageddon: Space Gladiators - Duke Mod Madness,https://i.ytimg.com/vi/Hbs3BZlAp_0/hqdefault.jpg,0.268967391,73600,2020-09-04T18:06:25Z,4/9/2020
Temporal Assassin (Half Life 2) - Mod Madness,https://i.ytimg.com/vi/3iqrRDe7kL0/hqdefault.jpg,0.446684783,73600,2020-08-23T15:16:43Z,23/8/2020
So I Tried... POST VOID,https://i.ytimg.com/vi/tWlEB8vzHdw/hqdefault.jpg,0.420923913,73600,2020-08-17T15:04:44Z,17/8/2020
So I Tried... The Citadel,https://i.ytimg.com/vi/x2j7Bbp2Gog/hqdefault.jpg,0.865013587,73600,2020-08-15T16:28:07Z,15/8/2020
Playing Among Us For The First Time!,https://i.ytimg.com/vi/QbbIDyOfpKQ/hqdefault.jpg,0.352049689,96600,2020-10-07T18:36:31Z,7/10/2020
What My Tattoo Means [FlukeMemes #007],https://i.ytimg.com/vi/AonLaf0LQ_g/hqdefault.jpg,0.439378882,96600,2020-09-30T08:18:24Z,30/9/2020
accepting my femininity.,https://i.ytimg.com/vi/gjU1yTBSeV8/hqdefault.jpg,0.84300207,96600,2020-09-23T07:37:39Z,23/9/2020
A Day In The Life Of A Husky [a skit],https://i.ytimg.com/vi/v6PyJ9X39ww/hqdefault.jpg,0.501821946,96600,2020-09-15T21:32:14Z,15/9/2020
