title,thumbnail,view_to_sub,channel_sub,published_at,published_at_date
Agua y Ciudades | ConCervezatorio Ambiental con Raúl Silva,https://i.ytimg.com/vi/dWylkZV4cpU/hqdefault.jpg,0.021845175,9430,2020-09-17T02:06:38Z,17/9/2020
¿Por qué tiembla en México? ¿Qué es un temblor? ¿Se pueden predecir? | Ciencias de la Tierra,https://i.ytimg.com/vi/Dt0hKIBai6I/hqdefault.jpg,0.032449629,9430,2020-09-19T14:59:33Z,19/9/2020
Tiendita del Campo | Unboxing de productos locales sostenibles,https://i.ytimg.com/vi/nrt6Zb5TdeU/hqdefault.jpg,0.016012725,9430,2020-09-16T19:30:45Z,16/9/2020
Camarones chasqueadores ¿cómo nos afectan? | Avances científicos,https://i.ytimg.com/vi/VZjfq_ke9Ao/hqdefault.jpg,0.02640509,9430,2020-09-12T10:14:15Z,12/9/2020
¿Podremos DEVOLVER la vida a los MUERTOS? | ESPECIAL OCTUBRE.,https://i.ytimg.com/vi/7McXXkqz52o/hqdefault.jpg,0.023958333,33600,2020-10-07T20:53:16Z,7/10/2020
¡Tenemos Super Chat y Super Stickers! Otra forma de apoyar a tu creadora de contenido | AVISO,https://i.ytimg.com/vi/p_76EipslKU/hqdefault.jpg,0.00985119,33600,2020-10-06T16:01:01Z,6/10/2020
#SoyNaturalista | Respondiendo a @Biologia sin censura,https://i.ytimg.com/vi/chlcM3bG-Xc/hqdefault.jpg,0.013779762,33600,2020-09-30T21:05:41Z,30/9/2020
El ORIGEN de las mascarillas N95 | Sara Little Turnbull | MUJERES CON CIENCIA.,https://i.ytimg.com/vi/71VL_jU5TS4/hqdefault.jpg,0.021607143,33600,2020-09-23T20:47:38Z,23/9/2020
"NO pruebes estos 5 ""remedios"" contra COVID.",https://i.ytimg.com/vi/EUoVkcFygi4/hqdefault.jpg,0.02360119,33600,2020-09-16T20:08:09Z,16/9/2020
¿Cuántos GLOBOS necesitas para ELEVAR UNA CASA? | Up: SCIENCE VS CINEMA.,https://i.ytimg.com/vi/Uj0I0ZqIMTE/hqdefault.jpg,0.028095238,33600,2020-09-09T20:59:02Z,9/9/2020
¿Qué pasa si te CAES en un AGUJERO NEGRO?,https://i.ytimg.com/vi/iA-m4q7vmR8/hqdefault.jpg,0.025267857,33600,2020-09-02T21:01:06Z,2/9/2020
¿El nuevo CORONAVIRUS tiene debilidades? | Mónica Olvera | MUJERES EN LA CIENCIA.,https://i.ytimg.com/vi/wrJ7QgS_amM/hqdefault.jpg,0.026785714,33600,2020-08-26T19:07:20Z,26/8/2020
¿Por qué EXISTEN los VIRUS?,https://i.ytimg.com/vi/EfjtXUgB-bY/hqdefault.jpg,0.033928571,33600,2020-08-19T18:23:41Z,19/8/2020
¿Quién llegó a América antes que Colón? - CuriosaMente 247,https://i.ytimg.com/vi/p3-HyM7n1g4/hqdefault.jpg,0.047405263,1710000,2020-10-10T18:56:18Z,10/10/2020
28 Palabras que el español adoptó de otros idiomas (Corregido) - CuriosaMente,https://i.ytimg.com/vi/OD7MOS5DZXE/hqdefault.jpg,0.029318713,1710000,2020-10-09T15:25:31Z,9/10/2020
¿Cómo derrite un ácido? (con experimento) - CuriosaMente,https://i.ytimg.com/vi/90mcwLTJ8sU/hqdefault.jpg,0.05592807,1710000,2020-10-07T22:38:48Z,7/10/2020
¿Tengo un trastorno mental? - CuriosaMente 246,https://i.ytimg.com/vi/HwSz2MGZUoo/hqdefault.jpg,0.062833918,1710000,2020-10-04T03:17:45Z,4/10/2020
😡 ¿Por qué nos enojamos? - CuriosaMente 245,https://i.ytimg.com/vi/LAN95iIsuo0/hqdefault.jpg,0.072937427,1710000,2020-09-26T18:31:46Z,26/9/2020
¿Qué pasa en tu CEREBRO cuando aprendes IDIOMAS? - CuriosaMente,https://i.ytimg.com/vi/s7OfMG7ccPE/hqdefault.jpg,0.103079532,1710000,2020-09-25T20:32:39Z,25/9/2020
¿Qué sabemos sobre el ALZHEIMER? - CuriosaMente 246,https://i.ytimg.com/vi/6lA6VngZfMI/hqdefault.jpg,0.054760819,1710000,2020-09-18T22:23:28Z,18/9/2020
¿Cómo ser políglota?,https://i.ytimg.com/vi/tdD4LOuLKWA/hqdefault.jpg,0.092272515,1710000,2020-09-17T21:01:44Z,17/9/2020
¿Quién decide qué está bien y qué está mal? ¿La moral es relativa o universal? - CuriosaMente 242,https://i.ytimg.com/vi/SBYJbnUCTQE/hqdefault.jpg,0.094471345,1710000,2020-09-12T02:16:13Z,12/9/2020
🌇 ¿Cómo serán las CIUDADES INTELIGENTES del FUTURO? | Smart Cities,https://i.ytimg.com/vi/6e6HH3Ij2uo/hqdefault.jpg,0.027189655,174000,2020-10-01T21:08:03Z,1/10/2020
¿Por qué AHORA hay más personas con ALERGIAS que hace un Siglo?,https://i.ytimg.com/vi/KisG4vDgcTo/hqdefault.jpg,0.029873563,174000,2020-09-08T04:16:46Z,8/9/2020
"¿Cuando NO estábamos solos? Neandertales, Homo Naledi y Homo Floresiensis",https://i.ytimg.com/vi/ge2XoifFH6M/hqdefault.jpg,0.091356322,174000,2020-08-29T10:56:27Z,29/8/2020
¿Hay vida en Venus? ¿Por qué tanto revuelo por la Fosfina?,https://i.ytimg.com/vi/OzEspL_dJy0/hqdefault.jpg,0.045091954,174000,2020-09-18T12:21:44Z,18/9/2020
¿Por qué nuestro cuerpo está más frío que hace 150 años?,https://i.ytimg.com/vi/TG3hXV2y8sA/hqdefault.jpg,0.042178161,174000,2020-08-25T14:27:10Z,25/8/2020
"🧠 Neuralink 2.0,  todas las novedades presentadas por Elon Musk 🐷",https://i.ytimg.com/vi/atDi8HYxf9A/hqdefault.jpg,0.063936782,174000,2020-09-03T05:04:04Z,3/9/2020
El Papel Higiénico está acabando con bosques de todo el Mundo,https://i.ytimg.com/vi/AFBvJCAk-as/hqdefault.jpg,0.034017241,174000,2020-08-22T09:07:11Z,22/8/2020
🚀 Las Claves del Éxito de SpaceX y la NASA con su misión Demo-2,https://i.ytimg.com/vi/QArPdMSmTZo/hqdefault.jpg,0.106195402,174000,2020-08-07T10:13:04Z,7/8/2020
"🚀 La Carrera Espacial a Marte (USA, China, Emiratos Árabes...)",https://i.ytimg.com/vi/DwZTzQUP2-4/hqdefault.jpg,0.198114943,174000,2020-07-31T09:51:18Z,31/7/2020
Anger and Forgiveness on the Internet - No Dumb Questions 089,https://i.ytimg.com/vi/_ajCDSOr3Jk/hqdefault.jpg,0.104356436,10100,2020-09-24T13:16:32Z,24/9/2020
Nuclear Fusion Propulsion 101 - No Dumb Questions 084,https://i.ytimg.com/vi/v7DyDZrcOrw/hqdefault.jpg,0.104257426,10100,2020-09-22T17:11:08Z,22/9/2020
Processing a Pandemic - No Dumb Questions 079,https://i.ytimg.com/vi/54fNIlYdtBY/hqdefault.jpg,0.045940594,10100,2020-09-22T17:02:44Z,22/9/2020
Which Animal Would Win? - 078,https://i.ytimg.com/vi/paIyn4S9dvU/hqdefault.jpg,0.090693069,10100,2020-09-14T23:28:50Z,14/9/2020
How NOT to Conduct a Job Interview (Hiring Correspondents!) - No Dumb Questions 092,https://i.ytimg.com/vi/Sjd8qtC1sUM/hqdefault.jpg,0.145346535,10100,2020-08-28T00:59:36Z,28/8/2020
The Dead Sea Scrolls - No Dumb Questions 088,https://i.ytimg.com/vi/dZw6v9j04L0/hqdefault.jpg,0.144653465,10100,2020-08-24T16:38:54Z,24/8/2020
62: Childhood Homes - The Unmade Podcast,https://i.ytimg.com/vi/W5V6eOWNHEo/hqdefault.jpg,0.197037037,4050,2020-10-07T01:39:57Z,7/10/2020
Special: Podcasters in a Car Getting KFC - The Unmade Podcast,https://i.ytimg.com/vi/qZvH0UVTtqA/hqdefault.jpg,0.335555556,4050,2020-09-30T09:00:39Z,30/9/2020
61: That's The Way I Remember It - The Unmade Podcast,https://i.ytimg.com/vi/xCxjeRZIlU0/hqdefault.jpg,0.210617284,4050,2020-09-22T23:30:57Z,22/9/2020
Special: Out of Ten - The Unmade Podcast,https://i.ytimg.com/vi/aGA5t0pEKyk/hqdefault.jpg,0.352345679,4050,2020-09-17T01:44:59Z,17/9/2020
60: The Summer of Seven Ducks - The Unmade Podcast,https://i.ytimg.com/vi/CCAKUpyToc8/hqdefault.jpg,0.278024691,4050,2020-09-15T12:50:02Z,15/9/2020
Special: The Balcony Episode - The Unmade Podcast,https://i.ytimg.com/vi/gdIWneMELls/hqdefault.jpg,0.727654321,4050,2020-09-11T13:19:35Z,11/9/2020
59: I Fought The Law - The Unmade Podcast,https://i.ytimg.com/vi/LZQfh0E7jLA/hqdefault.jpg,0.280987654,4050,2020-09-08T05:53:43Z,8/9/2020
Special: Picture in 1000 Words - The Unmade Podcast,https://i.ytimg.com/vi/793_5P-92No/hqdefault.jpg,0.265432099,4050,2020-09-01T12:11:40Z,1/9/2020
58: Hazelwood Power Station - The Unmade Podcast,https://i.ytimg.com/vi/8DP8DfluaHY/hqdefault.jpg,0.31037037,4050,2020-08-27T12:51:52Z,27/8/2020
Water Is Thicker When You’re Smaller,https://i.ytimg.com/vi/TUf2X3hqCPU/hqdefault.jpg,0.076571096,429000,2020-10-12T18:47:51Z,12/10/2020
Do Microscopic Immortals Actually Exist?,https://i.ytimg.com/vi/vSV9G5s4_SM/hqdefault.jpg,0.104967366,429000,2020-10-03T18:05:58Z,3/10/2020
Can Microbes See Without Eyes?,https://i.ytimg.com/vi/aHs2Vh-Llrc/hqdefault.jpg,0.15262704,429000,2020-09-29T01:59:53Z,29/9/2020
Ophyroglena: The Tricky Transforming Ciliate,https://i.ytimg.com/vi/17tug6T-4jc/hqdefault.jpg,0.114237762,429000,2020-09-21T15:09:45Z,21/9/2020
The Fungus That Traps and Kills Nematodes,https://i.ytimg.com/vi/V6g3OjkhClE/hqdefault.jpg,0.191561772,429000,2020-09-13T16:31:07Z,13/9/2020
Lacrymaria: Vicious Long-Necked Predators,https://i.ytimg.com/vi/rWtMIQguUOo/hqdefault.jpg,0.24167366,429000,2020-09-06T23:22:14Z,6/9/2020
Our Paramecia Are Infected,https://i.ytimg.com/vi/foKz81ElCjM/hqdefault.jpg,0.245932401,429000,2020-08-31T00:46:53Z,31/8/2020
Flatworms: Simple Wiggly Tubes,https://i.ytimg.com/vi/KmiHo_tYwkk/hqdefault.jpg,0.170018648,429000,2020-08-24T04:36:06Z,24/8/2020
How Do Microorganisms Poop Without a Butthole?,https://i.ytimg.com/vi/G2oRwfyyQgg/hqdefault.jpg,0.182370629,429000,2020-08-17T14:13:43Z,17/8/2020
How Political Questions Mess with Your Brain,https://i.ytimg.com/vi/8NYaDNK0xvM/hqdefault.jpg,0.069510708,607000,2020-10-08T18:29:42Z,8/10/2020
"We Don't All Have a ""Mind's Eye"" | Aphantasia",https://i.ytimg.com/vi/A91tvp0b1fY/hqdefault.jpg,0.114285008,607000,2020-10-01T19:24:19Z,1/10/2020
How Losing Your Job Changes You,https://i.ytimg.com/vi/LaX2Db9syRg/hqdefault.jpg,0.055116969,607000,2020-09-22T18:36:46Z,22/9/2020
How Psychics Exploit Our Cognitive Biases,https://i.ytimg.com/vi/4nq-g1BXkt8/hqdefault.jpg,0.061477759,607000,2020-09-17T15:09:06Z,17/9/2020
Why Is It So Hard to Remember Things Right Now?,https://i.ytimg.com/vi/ULdW78vnRQs/hqdefault.jpg,0.103644152,607000,2020-09-10T16:37:58Z,10/9/2020
Studying the Brain with... Quantum Mechanics?,https://i.ytimg.com/vi/xsGJkSDtLvo/hqdefault.jpg,0.140321252,607000,2020-09-03T20:51:28Z,3/9/2020
Why We Love Movie Villains (According to Psychology),https://i.ytimg.com/vi/2IkBJogw5G0/hqdefault.jpg,0.076975288,607000,2020-08-27T19:50:42Z,27/8/2020
3 Friendly Robots Improving Our Social Lives,https://i.ytimg.com/vi/jwwr5zuaW9o/hqdefault.jpg,0.042965404,607000,2020-08-20T15:23:40Z,20/8/2020
What Whistled Speech Tells Us About How the Brain Interprets Language,https://i.ytimg.com/vi/7gvfDB5_cz4/hqdefault.jpg,0.056807249,607000,2020-08-13T15:57:35Z,13/8/2020
How Political Questions Mess with Your Brain,https://i.ytimg.com/vi/8NYaDNK0xvM/hqdefault.jpg,0.069510708,607000,2020-10-08T18:29:42Z,8/10/2020
"We Don't All Have a ""Mind's Eye"" | Aphantasia",https://i.ytimg.com/vi/A91tvp0b1fY/hqdefault.jpg,0.114285008,607000,2020-10-01T19:24:19Z,1/10/2020
How Losing Your Job Changes You,https://i.ytimg.com/vi/LaX2Db9syRg/hqdefault.jpg,0.055116969,607000,2020-09-22T18:36:46Z,22/9/2020
How Psychics Exploit Our Cognitive Biases,https://i.ytimg.com/vi/4nq-g1BXkt8/hqdefault.jpg,0.061477759,607000,2020-09-17T15:09:06Z,17/9/2020
Why Is It So Hard to Remember Things Right Now?,https://i.ytimg.com/vi/ULdW78vnRQs/hqdefault.jpg,0.103644152,607000,2020-09-10T16:37:58Z,10/9/2020
Studying the Brain with... Quantum Mechanics?,https://i.ytimg.com/vi/xsGJkSDtLvo/hqdefault.jpg,0.140321252,607000,2020-09-03T20:51:28Z,3/9/2020
Why We Love Movie Villains (According to Psychology),https://i.ytimg.com/vi/2IkBJogw5G0/hqdefault.jpg,0.076975288,607000,2020-08-27T19:50:42Z,27/8/2020
3 Friendly Robots Improving Our Social Lives,https://i.ytimg.com/vi/jwwr5zuaW9o/hqdefault.jpg,0.042965404,607000,2020-08-20T15:23:40Z,20/8/2020
What Whistled Speech Tells Us About How the Brain Interprets Language,https://i.ytimg.com/vi/7gvfDB5_cz4/hqdefault.jpg,0.056807249,607000,2020-08-13T15:57:35Z,13/8/2020
"""Life"" on Venus and other nature news from September 2020",https://i.ytimg.com/vi/jwNoAL3z94U/hqdefault.jpg,0.063647059,17000,2020-09-25T23:16:31Z,25/9/2020
How Ankylosaurs Got Their Clubs,https://i.ytimg.com/vi/lRt-4SdzWrk/hqdefault.jpg,0.036065333,1500000,2020-10-13T21:18:07Z,13/10/2020
How Plants Became Carnivores,https://i.ytimg.com/vi/aGJ7tg0ifmo/hqdefault.jpg,0.213256667,1500000,2020-10-07T15:48:42Z,7/10/2020
The First and Last North American Primates,https://i.ytimg.com/vi/WNL9Jp9oeYA/hqdefault.jpg,0.15362,1500000,2020-09-30T18:20:29Z,30/9/2020
When Rodents Had Horns,https://i.ytimg.com/vi/zwJwAstYV2w/hqdefault.jpg,0.169894,1500000,2020-09-15T20:17:30Z,15/9/2020
The Sea Monster from the Andes,https://i.ytimg.com/vi/1MCZrZiq9BE/hqdefault.jpg,0.231124,1500000,2020-09-10T19:22:59Z,10/9/2020
How Ancient Art Captured Australian Megafauna,https://i.ytimg.com/vi/Zdm-6P6AdcA/hqdefault.jpg,0.205163333,1500000,2020-09-02T17:16:22Z,2/9/2020
The Oddest Couple in the Fossil Record,https://i.ytimg.com/vi/T2kURaqzCdA/hqdefault.jpg,0.412376,1500000,2020-08-20T21:04:30Z,20/8/2020
How We Figured Out Fermentation,https://i.ytimg.com/vi/-ntbeRiQ0cg/hqdefault.jpg,0.300151333,1500000,2020-08-13T21:26:11Z,13/8/2020
The Dinosaur Who Was Buried at Sea,https://i.ytimg.com/vi/a-UZXBF63z4/hqdefault.jpg,0.592152667,1500000,2020-08-05T17:34:23Z,5/8/2020
Water Is Thicker When You’re Smaller,https://i.ytimg.com/vi/TUf2X3hqCPU/hqdefault.jpg,0.076571096,429000,2020-10-12T18:47:51Z,12/10/2020
Do Microscopic Immortals Actually Exist?,https://i.ytimg.com/vi/vSV9G5s4_SM/hqdefault.jpg,0.104967366,429000,2020-10-03T18:05:58Z,3/10/2020
Can Microbes See Without Eyes?,https://i.ytimg.com/vi/aHs2Vh-Llrc/hqdefault.jpg,0.15262704,429000,2020-09-29T01:59:53Z,29/9/2020
Ophyroglena: The Tricky Transforming Ciliate,https://i.ytimg.com/vi/17tug6T-4jc/hqdefault.jpg,0.114237762,429000,2020-09-21T15:09:45Z,21/9/2020
The Fungus That Traps and Kills Nematodes,https://i.ytimg.com/vi/V6g3OjkhClE/hqdefault.jpg,0.191561772,429000,2020-09-13T16:31:07Z,13/9/2020
Lacrymaria: Vicious Long-Necked Predators,https://i.ytimg.com/vi/rWtMIQguUOo/hqdefault.jpg,0.24167366,429000,2020-09-06T23:22:14Z,6/9/2020
Our Paramecia Are Infected,https://i.ytimg.com/vi/foKz81ElCjM/hqdefault.jpg,0.245932401,429000,2020-08-31T00:46:53Z,31/8/2020
Flatworms: Simple Wiggly Tubes,https://i.ytimg.com/vi/KmiHo_tYwkk/hqdefault.jpg,0.170018648,429000,2020-08-24T04:36:06Z,24/8/2020
How Do Microorganisms Poop Without a Butthole?,https://i.ytimg.com/vi/G2oRwfyyQgg/hqdefault.jpg,0.182370629,429000,2020-08-17T14:13:43Z,17/8/2020
How Different Generations Talk About Climate Change | Hot Mess,https://i.ytimg.com/vi/TQYo9nk-Zlw/hqdefault.jpg,0.070703043,95300,2020-09-24T17:00:49Z,24/9/2020
"Jon Cozart Talks PewDiePie & YouTube Hierarchy, His Gross First Kiss, The Rock & 2020 Election Ep 39",https://i.ytimg.com/vi/ibHoyBkB-pY/hqdefault.jpg,0.158937008,254000,2020-10-07T17:09:40Z,7/10/2020
"Daniel Negreanu Reveals His Secret To Winning Over $40 Million In Poker, Growing Wealth & More Ep 38",https://i.ytimg.com/vi/jo_-io2aweY/hqdefault.jpg,0.09,254000,2020-09-30T17:07:28Z,30/9/2020
"Jacksepticeye Opens Up About His YT Break, Coffee Company, Therapy, & The Gaming Community Ep. 37",https://i.ytimg.com/vi/Lvb95pAliVI/hqdefault.jpg,0.824523622,254000,2020-09-09T16:16:00Z,9/9/2020
"I Tried To Get Mia Khalifa To Open Up About Plastic Surgery, Controversy, & New Marriage Struggles",https://i.ytimg.com/vi/MWuBCmf8TWw/hqdefault.jpg,0.464031496,254000,2020-08-26T19:29:06Z,26/8/2020
"I Tried To Make MatPat Cry As He Reveals His Biggest Youtube Regret, New Dad Experiences, & More",https://i.ytimg.com/vi/gyHiBdEuTRo/hqdefault.jpg,1.049964567,254000,2020-08-12T16:39:34Z,12/8/2020
"Jon Cozart Talks PewDiePie & YouTube Hierarchy, His Gross First Kiss, The Rock & 2020 Election Ep 39",https://i.ytimg.com/vi/ibHoyBkB-pY/hqdefault.jpg,0.158937008,254000,2020-10-07T17:09:40Z,7/10/2020
"Daniel Negreanu Reveals His Secret To Winning Over $40 Million In Poker, Growing Wealth & More Ep 38",https://i.ytimg.com/vi/jo_-io2aweY/hqdefault.jpg,0.09,254000,2020-09-30T17:07:28Z,30/9/2020
"Jacksepticeye Opens Up About His YT Break, Coffee Company, Therapy, & The Gaming Community Ep. 37",https://i.ytimg.com/vi/Lvb95pAliVI/hqdefault.jpg,0.824523622,254000,2020-09-09T16:16:00Z,9/9/2020
"I Tried To Get Mia Khalifa To Open Up About Plastic Surgery, Controversy, & New Marriage Struggles",https://i.ytimg.com/vi/MWuBCmf8TWw/hqdefault.jpg,0.464031496,254000,2020-08-26T19:29:06Z,26/8/2020
"I Tried To Make MatPat Cry As He Reveals His Biggest Youtube Regret, New Dad Experiences, & More",https://i.ytimg.com/vi/gyHiBdEuTRo/hqdefault.jpg,1.049964567,254000,2020-08-12T16:39:34Z,12/8/2020
Jon Cozart Reveals His Gross First Kiss Story...,https://i.ytimg.com/vi/vgPfahUoB2U/hqdefault.jpg,0.024360902,26600,2020-10-06T02:43:17Z,6/10/2020
"Jon Cozart Talks PewDiePie, The Rock, Charlie D'Amelio & If Influencers Have Influence Anymore...",https://i.ytimg.com/vi/WYQF37xsUIo/hqdefault.jpg,0.099887218,26600,2020-10-06T02:42:13Z,6/10/2020
Daniel Negreanu AKA RealKidPoker Reveals Secrets of Becoming A Poker Champion & Making $$$,https://i.ytimg.com/vi/xcdX9pY-sm8/hqdefault.jpg,0.019135338,26600,2020-09-30T03:06:42Z,30/9/2020
Six Time World Series of Poker Champion Daniel Negreanu Reveals How He Defines Success...,https://i.ytimg.com/vi/WY32yjpYuEk/hqdefault.jpg,0.150225564,26600,2020-09-29T17:23:19Z,29/9/2020
What Is The Secret to Jacksepticeye's Success?!,https://i.ytimg.com/vi/UVHWbuS-DpY/hqdefault.jpg,0.034548872,26600,2020-09-08T19:01:33Z,8/9/2020
Jacksepticeye Reveals The Real Reason Why He Started His YouTube Channel...,https://i.ytimg.com/vi/6FnkixFJoKQ/hqdefault.jpg,0.362067669,26600,2020-09-08T17:17:14Z,8/9/2020
Mia Khalifa Reveals Why Her New Husband Is Struggling With Her Past...,https://i.ytimg.com/vi/fP_9iEovgS8/hqdefault.jpg,0.17406015,26600,2020-08-27T17:01:16Z,27/8/2020
Mia Khalifa Speaks Out About Lebanon & Auctioning Off Her Infamous Glasses on eBay...,https://i.ytimg.com/vi/5rpb0_mpMv0/hqdefault.jpg,0.113496241,26600,2020-08-25T21:05:38Z,25/8/2020
MatPat Talks Food Theory Launch & Why He's Proud Of The Content He Makes...,https://i.ytimg.com/vi/Xh3M_9zXY3U/hqdefault.jpg,0.050075188,26600,2020-08-11T16:10:37Z,11/8/2020
Barrett Thinks YOUR BOSS Can Call You The N-Word,https://i.ytimg.com/vi/_JRA4aQytAU/hqdefault.jpg,0.051086093,302000,2020-10-13T19:51:19Z,13/10/2020
Trump HARASSES Fauci After Using Him In Lie-Filled Ad,https://i.ytimg.com/vi/mUI9MLxLS3M/hqdefault.jpg,0.030688742,302000,2020-10-13T18:49:49Z,13/10/2020
McConnell Creepily SNICKERS When Confronted About Stimulus Failures,https://i.ytimg.com/vi/5chWiZZ0MR4/hqdefault.jpg,0.040192053,302000,2020-10-13T17:42:47Z,13/10/2020
Amy Coney Barrett Has A HISTORY Of Election Rigging,https://i.ytimg.com/vi/MBpcaeKMASU/hqdefault.jpg,0.05357947,302000,2020-10-12T18:20:08Z,12/10/2020
Potentially INFECTIOUS Mike Lee SHOWS UP At Barrett Hearings,https://i.ytimg.com/vi/qLxtqf_QBN4/hqdefault.jpg,0.03255298,302000,2020-10-12T17:42:04Z,12/10/2020
Pelosi Targets Trump's Fitness For Office With Reckless Bill,https://i.ytimg.com/vi/ayAi3SXnEV4/hqdefault.jpg,0.044304636,302000,2020-10-09T19:24:54Z,9/10/2020
Trump Aide SQUIRMS As He's CORNERED On Trump's COVID Tests,https://i.ytimg.com/vi/7ig1aQCqa2o/hqdefault.jpg,0.058218543,302000,2020-10-09T18:19:48Z,9/10/2020
Pete Buttigieg Goes Viral By Turning The Tables On Fox News,https://i.ytimg.com/vi/AwDZtW-_kPI/hqdefault.jpg,0.361990066,302000,2020-10-08T19:35:24Z,8/10/2020
Republican Senator Admits He Hates Democracy,https://i.ytimg.com/vi/tSwAH89smII/hqdefault.jpg,0.063807947,302000,2020-10-08T18:30:24Z,8/10/2020
Barrett Thinks YOUR BOSS Can Call You The N-Word,https://i.ytimg.com/vi/_JRA4aQytAU/hqdefault.jpg,0.051086093,302000,2020-10-13T19:51:19Z,13/10/2020
Trump HARASSES Fauci After Using Him In Lie-Filled Ad,https://i.ytimg.com/vi/mUI9MLxLS3M/hqdefault.jpg,0.030688742,302000,2020-10-13T18:49:49Z,13/10/2020
McConnell Creepily SNICKERS When Confronted About Stimulus Failures,https://i.ytimg.com/vi/5chWiZZ0MR4/hqdefault.jpg,0.040192053,302000,2020-10-13T17:42:47Z,13/10/2020
Amy Coney Barrett Has A HISTORY Of Election Rigging,https://i.ytimg.com/vi/MBpcaeKMASU/hqdefault.jpg,0.05357947,302000,2020-10-12T18:20:08Z,12/10/2020
Potentially INFECTIOUS Mike Lee SHOWS UP At Barrett Hearings,https://i.ytimg.com/vi/qLxtqf_QBN4/hqdefault.jpg,0.03255298,302000,2020-10-12T17:42:04Z,12/10/2020
Pelosi Targets Trump's Fitness For Office With Reckless Bill,https://i.ytimg.com/vi/ayAi3SXnEV4/hqdefault.jpg,0.044304636,302000,2020-10-09T19:24:54Z,9/10/2020
Trump Aide SQUIRMS As He's CORNERED On Trump's COVID Tests,https://i.ytimg.com/vi/7ig1aQCqa2o/hqdefault.jpg,0.058218543,302000,2020-10-09T18:19:48Z,9/10/2020
Pete Buttigieg Goes Viral By Turning The Tables On Fox News,https://i.ytimg.com/vi/AwDZtW-_kPI/hqdefault.jpg,0.361990066,302000,2020-10-08T19:35:24Z,8/10/2020
Republican Senator Admits He Hates Democracy,https://i.ytimg.com/vi/tSwAH89smII/hqdefault.jpg,0.063807947,302000,2020-10-08T18:30:24Z,8/10/2020
Democrat's EPIC Supreme Court Exposé,https://i.ytimg.com/vi/CeY64XgJtd0/hqdefault.jpg,0.365440415,57900,2020-10-13T20:01:58Z,13/10/2020
"""He Has the GALL to Hold up a Bible?""",https://i.ytimg.com/vi/-wpFcpbDIbA/hqdefault.jpg,0.224853195,57900,2020-10-13T15:55:20Z,13/10/2020
Barrett WON'T SAY If Trump Can DELAY the Election,https://i.ytimg.com/vi/JvqDzGp77M8/hqdefault.jpg,0.383022453,57900,2020-10-13T14:40:49Z,13/10/2020
Kamala Harris Hits GOP with Myka,https://i.ytimg.com/vi/59YvxQFXR0A/hqdefault.jpg,0.182953368,57900,2020-10-13T14:00:01Z,13/10/2020
Leahy RIPS Lindsey Graham,https://i.ytimg.com/vi/NglbzPiczIM/hqdefault.jpg,0.401865285,57900,2020-10-13T13:15:01Z,13/10/2020
"""I'll Just Give You a Big Fat Kiss""",https://i.ytimg.com/vi/WztZCCks6mg/hqdefault.jpg,0.054265976,57900,2020-10-13T12:32:04Z,13/10/2020
Harris BLASTS Republican Hypocrisy on Trump's Nominee,https://i.ytimg.com/vi/MNXJqHlwfRw/hqdefault.jpg,0.538877375,57900,2020-10-12T19:30:01Z,12/10/2020
McCain & GOP Prosecutor Endorse Biden,https://i.ytimg.com/vi/29FrDZfbNCw/hqdefault.jpg,0.360069085,57900,2020-10-12T18:45:01Z,12/10/2020
Klobuchar Gets PERSONAL Against Barrett,https://i.ytimg.com/vi/6AVUNfdgM2s/hqdefault.jpg,0.368255613,57900,2020-10-12T18:00:01Z,12/10/2020
Democrat's EPIC Supreme Court Exposé,https://i.ytimg.com/vi/CeY64XgJtd0/hqdefault.jpg,0.365440415,57900,2020-10-13T20:01:58Z,13/10/2020
"""He Has the GALL to Hold up a Bible?""",https://i.ytimg.com/vi/-wpFcpbDIbA/hqdefault.jpg,0.224853195,57900,2020-10-13T15:55:20Z,13/10/2020
Barrett WON'T SAY If Trump Can DELAY the Election,https://i.ytimg.com/vi/JvqDzGp77M8/hqdefault.jpg,0.383022453,57900,2020-10-13T14:40:49Z,13/10/2020
Kamala Harris Hits GOP with Myka,https://i.ytimg.com/vi/59YvxQFXR0A/hqdefault.jpg,0.182953368,57900,2020-10-13T14:00:01Z,13/10/2020
Leahy RIPS Lindsey Graham,https://i.ytimg.com/vi/NglbzPiczIM/hqdefault.jpg,0.401865285,57900,2020-10-13T13:15:01Z,13/10/2020
"""I'll Just Give You a Big Fat Kiss""",https://i.ytimg.com/vi/WztZCCks6mg/hqdefault.jpg,0.054265976,57900,2020-10-13T12:32:04Z,13/10/2020
Harris BLASTS Republican Hypocrisy on Trump's Nominee,https://i.ytimg.com/vi/MNXJqHlwfRw/hqdefault.jpg,0.538877375,57900,2020-10-12T19:30:01Z,12/10/2020
McCain & GOP Prosecutor Endorse Biden,https://i.ytimg.com/vi/29FrDZfbNCw/hqdefault.jpg,0.360069085,57900,2020-10-12T18:45:01Z,12/10/2020
Klobuchar Gets PERSONAL Against Barrett,https://i.ytimg.com/vi/6AVUNfdgM2s/hqdefault.jpg,0.368255613,57900,2020-10-12T18:00:01Z,12/10/2020
Barrett Thinks YOUR BOSS Can Call You The N-Word,https://i.ytimg.com/vi/_JRA4aQytAU/hqdefault.jpg,0.051086093,302000,2020-10-13T19:51:19Z,13/10/2020
Trump HARASSES Fauci After Using Him In Lie-Filled Ad,https://i.ytimg.com/vi/mUI9MLxLS3M/hqdefault.jpg,0.030688742,302000,2020-10-13T18:49:49Z,13/10/2020
McConnell Creepily SNICKERS When Confronted About Stimulus Failures,https://i.ytimg.com/vi/5chWiZZ0MR4/hqdefault.jpg,0.040192053,302000,2020-10-13T17:42:47Z,13/10/2020
Amy Coney Barrett Has A HISTORY Of Election Rigging,https://i.ytimg.com/vi/MBpcaeKMASU/hqdefault.jpg,0.05357947,302000,2020-10-12T18:20:08Z,12/10/2020
Potentially INFECTIOUS Mike Lee SHOWS UP At Barrett Hearings,https://i.ytimg.com/vi/qLxtqf_QBN4/hqdefault.jpg,0.032556291,302000,2020-10-12T17:42:04Z,12/10/2020
Pelosi Targets Trump's Fitness For Office With Reckless Bill,https://i.ytimg.com/vi/ayAi3SXnEV4/hqdefault.jpg,0.044304636,302000,2020-10-09T19:24:54Z,9/10/2020
Trump Aide SQUIRMS As He's CORNERED On Trump's COVID Tests,https://i.ytimg.com/vi/7ig1aQCqa2o/hqdefault.jpg,0.058218543,302000,2020-10-09T18:19:48Z,9/10/2020
Pete Buttigieg Goes Viral By Turning The Tables On Fox News,https://i.ytimg.com/vi/AwDZtW-_kPI/hqdefault.jpg,0.361990066,302000,2020-10-08T19:35:24Z,8/10/2020
Republican Senator Admits He Hates Democracy,https://i.ytimg.com/vi/tSwAH89smII/hqdefault.jpg,0.063807947,302000,2020-10-08T18:30:24Z,8/10/2020
Democrat's EPIC Supreme Court Exposé,https://i.ytimg.com/vi/CeY64XgJtd0/hqdefault.jpg,0.365440415,57900,2020-10-13T20:01:58Z,13/10/2020
"""He Has the GALL to Hold up a Bible?""",https://i.ytimg.com/vi/-wpFcpbDIbA/hqdefault.jpg,0.224853195,57900,2020-10-13T15:55:20Z,13/10/2020
Barrett WON'T SAY If Trump Can DELAY the Election,https://i.ytimg.com/vi/JvqDzGp77M8/hqdefault.jpg,0.383022453,57900,2020-10-13T14:40:49Z,13/10/2020
Kamala Harris Hits GOP with Myka,https://i.ytimg.com/vi/59YvxQFXR0A/hqdefault.jpg,0.182953368,57900,2020-10-13T14:00:01Z,13/10/2020
Leahy RIPS Lindsey Graham,https://i.ytimg.com/vi/NglbzPiczIM/hqdefault.jpg,0.401865285,57900,2020-10-13T13:15:01Z,13/10/2020
"""I'll Just Give You a Big Fat Kiss""",https://i.ytimg.com/vi/WztZCCks6mg/hqdefault.jpg,0.054265976,57900,2020-10-13T12:32:04Z,13/10/2020
Harris BLASTS Republican Hypocrisy on Trump's Nominee,https://i.ytimg.com/vi/MNXJqHlwfRw/hqdefault.jpg,0.538877375,57900,2020-10-12T19:30:01Z,12/10/2020
McCain & GOP Prosecutor Endorse Biden,https://i.ytimg.com/vi/29FrDZfbNCw/hqdefault.jpg,0.360069085,57900,2020-10-12T18:45:01Z,12/10/2020
Klobuchar Gets PERSONAL Against Barrett,https://i.ytimg.com/vi/6AVUNfdgM2s/hqdefault.jpg,0.368255613,57900,2020-10-12T18:00:01Z,12/10/2020
Barrett Thinks YOUR BOSS Can Call You The N-Word,https://i.ytimg.com/vi/_JRA4aQytAU/hqdefault.jpg,0.051086093,302000,2020-10-13T19:51:19Z,13/10/2020
Trump HARASSES Fauci After Using Him In Lie-Filled Ad,https://i.ytimg.com/vi/mUI9MLxLS3M/hqdefault.jpg,0.030688742,302000,2020-10-13T18:49:49Z,13/10/2020
McConnell Creepily SNICKERS When Confronted About Stimulus Failures,https://i.ytimg.com/vi/5chWiZZ0MR4/hqdefault.jpg,0.040192053,302000,2020-10-13T17:42:47Z,13/10/2020
